지역,loc,score,review
광주,무등산국립공원,40,"무등산 국립 공원은 광주 동부 변두리에 위치하고 있습니다. 우리 게스트 하우스는 택시를 타러 우리 호스트의 조언을 따랐을 때 도시의 동쪽에 있습니다. 9 분, 500 원 택시 타기 20 분. 2 명은 나쁘지 않습니다. (나는 버스 옵션에 관해 나중에 말할 것이다)  우리가 도착할 때까지 NP는 우리가 그것이 많은 다른 입구 (우리는 배회하는 사람 역에 각각이 온다라고 들었다)로 거대하다라는 것을 알고있게했다. 우리는 우리가 Mudeungsan에 가고 싶었던 영어가 아닌 운전자에게 말했다 (이것은 거의 모두 우리가 의사 소통 할 수있는 것이다), 놀라는 정도에 그는 우리를 서 석대 & Ipseodae - 가장 유명한 2 개의 암석이있는 NP의 가장 높은 지점.  우리를 환영 한 레인저는 매우 도와주고 싶어하지만 영어는 기본입니다. 우리가 하이킹에서 돌아오고 난 후에 우리는 영어로 이야기하는 직원과 흔적지도와 함께 뒤에 숨어 들어오는 배회하는 사람 사무실이 영어로 있다는 것을 알았다!  어쨌든 원효 레인저 스테이션에서 돌아 오는 하이킹은 7입니다. 8km 길이, 제안 된 반환 시간은 4 시간입니다. 첫 번째 2/3은 중간 정도이며, 마지막 1/3은 약간 가파르고 미끄 럽습니다. 작은 덩어리가 많아 튼튼한 부츠가 도움이 될 것입니다. 8 월 하순에 습기가 있으므로 많은 양의 물을 가져 오십시오.  우리가 정상에 도착했을 때 우리는 흔적이있는 표시가 길이 또는 제안하는 시간을 말하지 않는 동안 계속할 많은 다른 흔적 (아마 배회하는 사람 역에 돌아 간다)이있다라고 말할 수있다. 그러나 영어로 흔적지도없이, 우리는 느꼈다 같은 방식으로 내려가는 것이 더 안전합니다.  앞서 언급했듯이 레인저 사무소에 가서 영어로 이야기하는 직원의 정보를 묻고 영어로지도를 작성한 다음 하이킹을 훨씬 더 잘 계획 할 수 있습니다.  대중 교통에 대해서는 1187 번 버스 터미널이 원효 사 입구에 위치하며 레인저 역에서 5 분 거리에 있습니다. 우리는 버스로 도시로 돌아 가기 전에 작은 원효사를 잠깐 방문했다.  원효 하이킹 코스는 길이가 적당하고 너무 어렵지 않기 때문에 추천 할 만합니다. 그리고 버스로 입구 지점에 도달 할 수 있습니다."
광주,무등산국립공원,50,"우리는 본격적인 하이킹을 있었음 몇 시간 포장된 트레일. 언덕들을 도보 및, 주변에. 다른 사람들이(아이들, 노인) 많았습니다-over 전혀 붐비지 않았습니다.  날씨가 환상적인, 아주 평화로웠어요. 에서 자연과 장소입니다. 있는 긴 하이킹 입고 같은 있었다 사람들이 있었지만 공원은 남자탁구 환영합니다.  적극 추천합니다."
광주,무등산국립공원,50,Mudengsan 매우 인기있는 곳입니다. 위쪽 및 아래쪽 하이킹을 꽤 Strenous 수 있습니다. 경치는 피곤한 기어오를 만한 가치가 있습니다. 매우 아름답고 편안한 숙식과 멋진 단풍을
광주,무등산국립공원,50,"광주 를 방문할 경우, 반드시 국립 공원 입니다. 시내에서, 버스를 타고 54 (다른 사람들도 많다). 택시로 약 5 usd 가운데 입구. 산책로도 잘 정비 되어 수십. 공원에서 쉬는 많은 불교 사원. 하이킹을 하기 전에, 많은 음식과 음료를 구입할 수 있고 바로 옆에 큰 주차장이 있는 경우에. 지도 영어 및 기타 언어로 사용할 수 있는 공원 입구 레인저 스테이션. 짧은 산책로가 있는 모든 포장 도로 에서, 어떤 신발을 신고 합니다. 하이킹 신발을 착용 한 이들이 해당 합니다, 생각은 - 가장 인상이 좋아 산 신발. 즐길 수 있는!"
광주,무등산국립공원,30,무등산 전성기는 지났다. 살아있는 때 였다. 재방문을 합니다. 첫 번째 시간은 정말 이 없었다. 더 나쁜 것만 있었기 때문. 하지 않을 것입니다.
광주,무등산국립공원,40,"쉽게 갈 수 있는 버스, 시내 근처, 좋습니다(플라스틱이 view.but 많은 사람들이 알고 있을 것이지 정보를 forigan. 어떤 정보 센터는 지하철 역,"
광주,무등산국립공원,50,"산이. 많은 산책로를 선택, 하지만 나는 시작부터 북쪽에 산 wonhyosa. 하고 있는 사람들. 입구는 아주 사람을 jeungshimsa. 날씨좋은날 에 걸쳐 멋진 전망과 광주 jeollansmdo. 하지만 준비 다. 광주 시내에 가까운 것임 불구하고, 여전히 매우 가파른 산 1187m, 불규칙적인 물과 소스 및 날씨 표이성의."
광주,무등산국립공원,50,"이 산은 매우 크고. 좋은 곳이지요. 하이킹을 즐길 수도 많은 사람들이 보는 어른들, 아이들, 청소년, 과 선배. 책임자가 아주 좋은 제안이 우리를 잘 수 있도록 빌라이져에 따라야 할 수 있습니다. 다양한 수준의 첨두값 하이킹. 그럴 때 좋은 전망을 해볼 것."
광주,무등산국립공원,50,"우리는 당연히 빨간 잎. 이는 날씨가 점점 어려워지고 시간이 에측방법을 더 이상합니다.  오는 11월 초를 엿볼 생각으로, 모든 빨간색 잎이 아직, 반 떨어지는, 어서 더 많은 아름다운 장면.  불행하게도 비가 내리는 모양. 하지만 날 믿어, 그래도 충분히 가치가 있. 와우 와우. 특히 도시 사람들, 나와 같은, 다른 곳이 많은 것을 볼 수 있지."
광주,무등산국립공원,40,"무등산 국립 공원에 가서 엄마, 아저씨와 아줌마. 9시까지 가는 버스 번호 (레드 라인) u 광장에서 터미널을 마지막으로 역 볏가을을. 나는 너무 놀라 오래된 사람들이 많아서 가기. 하이킹 자장치 공원 입구에서 찾을 수 있습니다. 카페와 레스토랑들이 있다. 가장 좋은 점은, 인터넷 연결도 사용! _AOMARKBLANKAO_"
광주,무등산국립공원,50,또한 잘 알려진 광호 - ju. 산 꼭대기에 있는 아주 좋은 풍경은 한번씩 게시됩니다. 이동할 수 있는 gawng 시티 버스 - ju.
광주,무등산국립공원,50,"국립 공원은 도시의 주요 명소는 순수한 자연의 아름다움과 증가된 작업자 기간섭이 지역만. 이곳은 거대한 시간 때문에 신중하게 관리 및 완전 해야 할, 하루 종일 관광을 할 것입니다. 물과 편안한 신발은 합니다."
광주,무등산국립공원,50,"이 모든 것을 찾을 수도 있습니다: 산악, 숲, 폭포, 오래된 사찰, 도보로 쉽게 올라갈 수 및 경로는 의 절벽. 쉽게 시내에서, 버스는 밤 늦게 까지, 최대 10 시. 매우 정신 을 기억할 수 있는 고대 아시아 및 자연 영화 정보. 절대적으로 방문해야 합니다."
광주,무등산국립공원,40,무등산에서 길을 잃기 어렵습니다. 게시물에 서명하고 필요한 모든 것은 무시함) 하이킹 경로 미합중국이 지정한 무작정된. 이 공원은 영어 및 체크포인트 이 잘 되어 있어. 나는 지도를 입구에서 공원은 공원 내에 있어 편리.
