지역,loc,score,review
광주,무등산국립공원,40,"무등산은 광주지역에 위치한 국립공원으로 마치 따뜻한 어머니 품처럼 느껴지는 정감어린 산이며, 어린이로 부터 어른에 이르기까지 누구나 오르기에 편해 가족등반에 아주 좋다."
광주,무등산국립공원,40,비가 와서 산 정상에 가지는 못했으나 다른 지역의 산들과는 다른 풍경을 확인하고 내려왔다. 비 안개가 산의 신비로움도 더했다.
광주,무등산국립공원,50,무등산을 가는 길은 여러방법이 있다 증심사로 가서 관광객모드로 보리밥 먹기 금곡동으로 가서 산장메뉴 맛보기 4수원지로 가서 트럭 떡볶이 먹기 담양창평서 밥먹고 광주호에서 넘어가기 지산동에서 커피한잔 하기 원효사로 가서 단풍과 계곡 즐기기 어디로 넘어가도 정말 사랑스러운 곳
광주,무등산국립공원,50,"증심사는 차를 가져 오지 않아도 버스편이 좋습니다. ~^^ 승용차가 있으면 무등산을 중심으로 주변 곳곳에 볼거리가 있지요..! 특히 광주호 호수생태원은 가볍게 산책하기 좋아요,,, 입장료는 없으며 적극 추천 합니다."
광주,무등산국립공원,50,"제목이 거창하다 뭐 개인적 의견이니 무시해도 좋다  하지만 제목에서 밝혔다시피 세계적으로 인구 백만이상의 도심에 위치하면서 해발 1000미터가 넘는 산은 흔하지 않다..내가 알기론 솔직히 없다  세계자연유산...일본이나 중국과 구별되는 한국식 정원문화를 볼 수 있는 가사문화권, 맛있는 음식점들 , 취향과 난이도에 따른 여러 등반코스등  광주에서 태어나 광주에서 사십년 넘게 살고 있으면서 수십 수백 차례 무등산을 가본 나 이지만 아직도 무등산에 대해서 모르는게 많다"
광주,무등산국립공원,50,광주 대표 명산. 너무 높지도 않고 낮지도 않고 산행하기 적당한것같음. 광주시내 어디에서든 보이는 무등산. 직접 등반하면 좋아요
광주,무등산국립공원,50,"저는 다른 분들처럼 높이 올라가진 못했고요, 근처 사찰음식 뷔페에서 밥 먹고 친구들과 슬슬 걸었습니다. 절이 정말 많아서 미국에서 온 친구들이 정말 흥미로워했어요. 친절한 아주머니들이 법당에 들어갈 수 있게 해주셔서 잠시 쉴 수도 있었답니다. 남도의 햇살은 정말 따가운데 바람이 솔솔 부니 나무들이 사악, 사악 흔들리는 게 정말 아름답더군요. 새 소리와 절 처마 끝 흔들리며 우는 종소리에 정말 힐링되었어요. 더 오래 있고 싶었습니다. 하늘은 정말 파랗고 숲도 파랗고, 구름은 토실토실. 신기했던 점은 개울같은 곳 이름이 ‘등산화 세척하는 곳’이었어요. 그리고 멧돼지 출몰할 수 있단 간판도 봤습니다. 내려오면서 카페에서 잠시 쉬면서 근 한달만에 에어컨 바람을 쑀습니다. 전체적으로 좋은 경험이었어요. 광주에 다시 내려올 수 있다면 다음엔 천천히 혼자 구경하고 싶어요. 아무래도 일행이 있으니 조금 서두르게 되더라고요."
광주,무등산국립공원,50,"위치 좋고 버스 많고 식당 많고 중머리재까진 한시간 안 운동 코스로 굿이구요 중봉까진 2시간 안, 서석대까진 3시간 안이면 가요. 위에 올라서 광주보면 장관이구요. 절경이네요"
광주,무등산국립공원,20,모노레일에 호기심이 생겨서 갔습니다....... 리프트랑 모노레일 패키지 15000원입니다.... 왜 그 금액인지 모르겠네요... 리프트는 그럭저럭했는데 모노레일은 생명의 위협을 느꼈습니다... 관리가 안되고 있다는게 느껴졌고. 화장실도 없어서 문의하였더니 여기는 아무대나가 화장실이라며 숲풀 아무곳에나 가서 볼일 보라시는 말에 황당 했습니다. 80년대 유원지 경험하는 기분이라 색다르면서 ㅋㅋㅋㅋ 다시는 안와도 되겠다는 마음이 들었네요
광주,무등산국립공원,50,시내 한가운데 있다고 해도 과언이 아닌 위치에 높은 산이지만 험하지 않은 등산로들을 다채롭게 갖추고 있으며 가족 단위로 방문하기 상당히 좋습니다. 또 드라이브 코스도 다채롭게 있어서 좋습니다. 내려오는 길에 식당들의 음식 맛도 상당히 좋으니 나들이에는 적합한 산입니다.
광주,무등산국립공원,40,지산유원지를 통해서 가볍게 무등산에 올랐습니다. 시원한 공기가 좋았습니다. 답답한 서울에서 벗어나서.... 간만에 숨돌리기...
광주,무등산국립공원,50,도심 근처에 가까이 있어 접근성이 아주 좋은 곳이에요.. 너무 아름답고 등산코스도 다양해서 힘들지 않은 코스는 아이들과도 쉽게 올라갈 수 있습니다.. 어느 계절에 가도 너무 너무 좋은 곳이에요...
광주,무등산국립공원,40,다만 사람이 그래도 아직 많이 없어 올라가도 가게도 다 닫혀있고 하네요 ㅠ 그부분만 보완하면 가끔 가기 좋아요
광주,무등산국립공원,50,이제 리뷰를 적는데 무등산은 1.1일에 등산 했습니다 매우 추웠지만 등반하고 나니 뿌듯하더라구요 내려오셔서 보리밥 한그릇 드세요 !!
광주,무등산국립공원,50,완만한 등산 끝에 나타난 절경.  주상절리. 서석대. 입석대...  너무 좋았고 다시 또 가고 싶은 산.
광주,무등산국립공원,50,무등산 리프트를 타고 모노레일 탐. 추석이라 사람들 엄청 많았지만 멋진 풍경을 감상할 수 있어서 추천함.
광주,무등산국립공원,50,담양이 바로 연결되어 드라이브에 매우 좋습니다. 밤에 가면 튜닝카들이 큰 소리를 내며 다니는데 가끔 한두대씩만 다닐 뿐 큰 상관 안하셔도 됩니다.  국립공원 답게 화장실도 나름 깨끗하게 사용할 수 있습니다.
광주,무등산국립공원,50,"시간나면 한번쯤은 방문해도 괜찮은 곳 같습니다. 경치도 훌륭하고, 등산로는 잘 되있어서 부담없이 올라갈 수 있어요! 주위 식당들도 많아서 식사하기도 편합니다"
광주,무등산국립공원,50,사계절에 따라 등반해도 무난하다 역시 유명하고 산풍경이 이쁩니다 증심사에 가보면 먹거리있고 등산쇼핑많이 있어서 저렴해서 좋습니다 등산좋아하시는분 추천합니다
광주,무등산국립공원,50,광주에 왔다면 한번쯤 올라가 봐야하는 산입니다. 정상에 서석대를 시작으로 장관을 이루는 멋진 풍경을 감상할 수 있습니다. 그다지 높지 않은 산이지만 볼거리도 많아 좋습니다. 정상까지 왕복 5시간 정도 생각하시고 가시면 될꺼같습니다.
광주,무등산국립공원,40,친구랑 같이 등반했는데 국립공원이라고 하드라고요. 경치도 좋고 보존도 잘 되어있어서 좋았습니다. 거기다가 산 밑에서 먹는 음식은 대박입니다. 다만 산이 다소 험합니다. 교통도 괜찮고 마음을 정리할 때 오세요.
광주,무등산국립공원,50,"전문 산악인은 아니지만 제가 다녀본 국립공원 산중에서 가장 정비가 잘 된 소위 '신상' 일 것같네요~. 그나마 가장 청결하고 잘 관리되고있는 공공 편의시설 및 주변 상가 와 식당가들..주차장 및 산행로 등...도심에 이런 좋은 산이 있다는것은 정말 광주광역시 시민들은 복받은 분들 같습니다. 도심 한 가운데 위치해서 너무나 접근성이 좋아서 마치 동네 뒷동산 가는 기분으로 언제든지 갈 수 있으니까요~. 자가용으로 간다면 무등산 증심사, 광주호 생태공원 등등도 꼭 같이 들리면 좋구요~."
광주,무등산국립공원,50,등산하고싶으면무등산이죸ㅋ중머리재에앉아서탁트인광주경관보고밥먹으면최고!서석대까지올라가야하지만너무힘듬
광주,무등산국립공원,50,경치는 말할 것도 없고 보존이 잘 되어 있어서 항상 갈때마다 기분이 좋습니다. 등산길에 먹는 막걸리와 전은 항상 빼놓을 수 없는 코스구요 등산을 마치고 삼계탕을 드시는 것도 좋습니다. 데이트 가족동반 모두 괜찮을 것 같아요.
광주,무등산국립공원,40,지산동 무등산 초입에는 무등산보리밥거리가 있는데 각종 밥집과 분위기있는 까페들이 많아 데이트분위기 내기 좋았습니다. 무등산파크호텔 앞에는 케이블카도 있었구요. 능선을 따라 무등산을 드라이브하며 산을 만끽한 날이었습니다.
광주,무등산국립공원,40,"도심과의 거리가 불과 20분 정도, 주차장에서 부터 바로 국립공원 의 산공기를 만끽하면서 트래킹 할 수 있습니다. 거기에 증심사와 미술관 맛있는 음식점 들이 주변에 풍부해서 언제든 방문하기에 적합합니다. 여러 등산 코스가 준비되어 있어서 본인의 취향에 맞추어서 짧고 완만한 코스부터 높은 산정상 까지 즐기 실수 있습니다."
광주,무등산국립공원,50,"도시에서 높은 산을 오르기 쉽지 않은데 무등산은 등산, 가벼운 탐방, 힐링, 계곡, 산사 등 잘 찾아보면 많은 것을 누릴 수 있습니다. 한달에 2번은 등산하는데 짧게는 2시간부터 길게는 다른 도시로 연결된 등산로까지 찾아보면 많은 코스가 있습니다. 어린이부터 무릎이 안좋은 어른도 가벼운 산행 가능하고 정해진 코스외에도 오르다 힘이들면 중간에 샛길로 빠져나와 포장된 도로로 쉽게 내려올 수도 있고, 산자락에 카페,보리밥집 등 많은 것을 제공해주는 고마운 산입니다. 또 더운 여름에는 계곡도 있어 저렴하게 여가를 보낼 수 있습니다."
광주,무등산국립공원,40,국립공원으로 지정된 후에 사람도 더 많게 느껴지지만 근처에 식당도 많구요 카페도 있구요~ 등산로코스가 여러개 있어서 좋은 곳이랍니다.
광주,무등산국립공원,40,광주를 대표하는 산으로써 많은 등산객들이 찾는 곳입니다. 산 고도가 높으며 산책로가 있어 힐링하기에는 좋습니다.
광주,무등산국립공원,40,광주시내에서 1187번 버스타고ㅡ찾아가서 자기.체력에 맞게 실컷 걷고 올수있습니다 생각보다 꽤 높은산이고 통제구역도 있으니.안내표지 잘 보고 다니면 되구요 워낙 교통이 광주시내와 연계가.잘 되어있어서 .찾아가기 좋은곳입니다
광주,무등산국립공원,50,정상까진 못했어요..하도 유명하고 높은 산이라 광주에 가면 꼭 한번 들러봐야겠다 생각했거든요~~~~ 역시 공기 좋고 꼭 한번 가봐야할 산이에요!
광주,무등산국립공원,40,시간이 나서 등산을 했습니다 생각보다 높았지만 아주 험한 편은 아닙니다. 아주 많은 노선의 버스가 무등산 등산로 입구까지 다녀서 교통편도 좋습니다. 그 주변으로 카페도 많아서 내려와서 이용했네요.
광주,무등산국립공원,40,정상은 아름다우나 등산을 하신다면 바람막이는 필수로 챙기세요 정상에 올라가니 바람이 꽤나 세더라구요
광주,무등산국립공원,50,무등산은 남도의 광주와 화순과 담양을 끼고 솟아있는 어머니 품과 같이 느껴지는 명산이다. 이제 국립공원으로 지정되어 새롭게 거듭나고 있어 찾는이들에게 깊은 정감을 안겨줄 것이다.
광주,무등산국립공원,40,광주시내에 있어 멀리가지 않아고 산을 방문할 수 있고. 경사가 가파르지 않아서 등산하기 수월함. 입구쪽에 식당들과 등산용품점이 많이 있음
광주,무등산국립공원,50,"1000미터가 넘는 고산임에도, 등반레벨은 비교적 easy 합니다. 물론 정상까진 갈 순 없지만...다양한 볼거리가 산재해 있어 광주시민들의 사랑을 많이 받는 산이기도 합니다. 국립공원으로 지정된 뒤에 정비가 되어 증심사쪽은 먹거리,쇼핑등이 잘 갖춰져 있기도 합니다. 본격적인 등반을 위해서는 증심사에서 출발하는 것이 좋고, 비교적 짧은 시간 동안 무등산을 즐기고, 담양등지의 다른 여행지를 찾는 여행자라면, 산장쪽으로 가서 잠깐 맛을 보는 것이 방법입니다. 여름철 산장쪽으로 가신다면 시원한 계곡에서 더위를 식히실 수도 있을거구요.^^ 겨울은 눈꽃이 아름답게 피어나 절경을 이룹니다."
광주,무등산국립공원,50,일반적으로 산장으로 가는 길과 증심사로 가는 길이 있음. 산장으로 가는 길은 도심에서 차로 20분쯤 들어가야 하고 증심사는 도심에서 상대적으로 가까워 대중교통이 편함. 코스가 매우 힘들지는 않고 여러 가지의 코스가 다양한 난이도임. 산장에서 출발해서 증심사로 내려오면서 점심식사 하면 좋음
광주,무등산국립공원,40,산을 취미로 하신 분이시라면 적극 추천. 무등산은 가을과 겨울이 가장 이뻐요! 적당히 가파르고 돌산도 아니어서 체력적인 부분만 바쳐주면 괜찮게 오를 수 있는 곳입니다.
광주,무등산국립공원,50,"광주 시내에서 시내버스로 가기도 좋고, 증심사입구에는 맛집도 많고, 스타벅스도 있어요. 커피도 한잔하고 싶고, 산바람맞고 싶을때 추천"
광주,무등산국립공원,50,광주광역시를 대표하는 무등산 국립공원! 얼마전에 국립공원으로 승격이 됐지요. 국립공원의 위상에 어울릴만한 아름다운 곳이랍니다! 단 주말엔 등산객들이 많아서 좀 혼잡하죠...
광주,무등산국립공원,50,"광주에서 가장 유명한 산입니다. 입구에는 각종 예쁜 카페와 상점들, 꼭대기에 올라서면 서석대와 입석대가 너무 아름답습니다. 중간인 중머릿재까지만 가셔도 멋지구요 초보자는 토끼등까지 오르는 것 추천합니다"
광주,무등산국립공원,50,드라이브하기도 좋고 등산하기에도 좋은 곳이에요. 무등산 내에 맛집과 카페도 많이 있어서 광주에 오면 꼭 들러야 할 곳이라고 생각합니다.
광주,무등산국립공원,50,무등산은 도심과 가까워서 많은시민들이 사랑하는 국립공원입니다 등산코스도 다양하여 가족끼리 친구들과 어떤경우도 좋은곳 입니다
광주,무등산국립공원,40,국립공원 입구에 미술관이 있어 등산보다는 미술관 체험을 하기에 좋았다. 가족끼리 여행하면서 아이가 있으면 등산보다 미술관 체험을 추천
광주,무등산국립공원,40,광주의 자랑. 예전에 무등산 하면 수박이었는데 지금은 어떤지 모르겠어요. 무등산호텔?이었나 옆에 리프트 시설이 있어 산정상?언저리까지 올라갈 수 있어요. 한번쯤 이용해 보는 것도 좋을듯해요.
광주,무등산국립공원,50,"규봉암의 풍광은 언제 보아도 아름다운데, 눈 내린 겨울풍광이 가장 아름다워요. 물론 가을철 단풍이 들었을 때도 아름다운데, 그래도 고즈넉한 겨울이 최고인듯."
광주,무등산국립공원,40,"국립공원으로 지정되고 방문객이 많아 졌지만, 시설도 더 좋아지고 코스도 관리에 신경 쓰는것 같다."
광주,무등산국립공원,40,광주는 맛있는 것들로 가득찬 곳이다. 무등산의 아래에는 많은 식당들이 있고 내가 갔던 곳도 맛있는 집이었다. 아침에 일찍 무등산에 오른다면 상쾌한 기분을 느낄 수 있을 것이다. 맑은 공기와 풍경들이 인상적인 곳이었다. 천천히 걸으며 등산 할 수 있는 곳이다. 사진찍으면서도 너무 즐거웠고 좋은 추억을 남기고 온 곳이었다. 다시한 번 가보고 싶은 곳이다.
광주,무등산국립공원,50,이 산에서는 정말 할 것이 많다. 풍경을 볼수 있는 곳과 절들이 있으며 강 쪽 아래에는 많은 식당들이 있다. (중심사 절 입구 쪽)
광주,무등산국립공원,50,나는 주말에 한국에서 얼마나 많은 사람들이 등산을 가는지 모르겠다. 당연히 아름다운 산에서 절은 제일 훌륭한 예술 작품이다. 등산용품이 한국에서는 비싸기 때문에 원래 갖고 있던 것을 가지고 오는 것이 좋다.
광주,무등산국립공원,40,"무등산은 광주를 보호하는 산이며, 모든 수준의 등산객들에게 하루 지내기 좋은 곳이다. 도시의 동쪽에 있으며 다양한 곳에서 버스를 타고 올 수 있는데 시내의 YMCA(지나가는 현지인에게 물어보면 모두 어디있는지 알려준다)를 지나는 버스를 타면 된다. 증심사를 가는 모든 버스(버스 정류장에서 영어로 방송해 줌)를 타면 산 근처의 식당으로 안내하지만, 1187번 버스는 내가 개인적으로 선호하는 등산 시작 점으로 데려다 준다. (모든 버스는 시내로 다시 돌아간다)  증심사 쪽에는 산 아래서부터 올라가면서 등산용품 가게와 카페, 그리고 많은 절들이 있고, 심지어는 미술관도 있는데 나는 한 번도 가 본적이 없다. 짧은 거리의 등산은 도시의 훌륭하고 환상적인 풍경을 보여주지만 정상에 갈 수 있으며 (군대 시설이 있기 때문에 꼭대기까지는 갈 수 없음) 오후에 돌아오거나 혹은 자연에 빠지고 싶다면 들판으로 갈 수 있다. 길은 잘 유지되어 있으며 (어떤 곳은 매우 잘 관리되어 있음) 증심사 쪽은 거의 항상 사람들로 붐빈다. 겨울에는 눈이 내리니 조심하고, 여름에는 많은 물이 필요하다.  만약 등산을 좋아하면 훌륭한 오후를 보낼 수 있을 것이고, 좋아하지 않더라도 방문할 만한 곳이다."
광주,무등산국립공원,40,"「비교할 산이 없음」이라는 의미의 무등산은 광주시의 상징이자 시민의 휴식의 공간이다. 공원 관리 사무소까지 버스로 갔다가, 거기서부터 등산이 됩니다. 도중에 유명한 절을 물어 가면서 산길을 즐길 수 있습니다. 길가에서는, 계절에 따라 각양각색의 산나물이나 야채, 음료가 판매되고 있습니다. 얼마나 화창한 등산입니까."
광주,무등산국립공원,50,점선이 공원 경계이고 명확한 선이 경로임을 깨달을 때까지 나는지도 전체에 문자 그대로있었습니다. 나는 완전히 즐거운 7 시간 하이킹으로 3 시간 하이킹을했다!
광주,무등산국립공원,50,우리는 공원을 통해 합리적으로 힘든 왕복 산책을했습니다. 한국의 광대 한 삼림 지역을 조금 맛볼 수있는 좋은 방법이었습니다. 우리는 지역의 친구에 의해 공원 입구까지 차로 갔다. 그리고 명랑한 공원 순찰자는 우리가 우리 산보를 시작하기 전에 우리에게 공원지도를 줬다. 숲은 다양하고 매우 매력적이었고 우리는 산보의 높은 지점에서 광주시로 좋은 전망을 얻었습니다. 산책로는 합리적으로 잘 표시되어 있지만 한국어로만되어 있습니다. . 우리는 버스로 광주로 돌아 왔는데 약 15 분 밖에 걸리지 않았습니다. 운전자가 아마 한국인이 아닌 사람들에게 발권 시스템을 설명하는 것보다 쉽다고 생각했기 때문에 무료 승차였습니다!
광주,무등산국립공원,50,두 명의 어린 아이들과 함께 방문 했으므로 3 분의 1 정도만 하이킹을했지만 좋은 시간을 보냈습니다. 공원 순찰대 원들은 매우 친절했고 하나는 놀라운 영어를 말했고 우리가 만난 가장 좋은 한국인 중 하나였습니다. 트레일은 잘 표시되어 있으며 정보 스테이션에 영어지도가 있습니다.
광주,무등산국립공원,50,"Sujata는 값이 싼, 너 - 먹을 수있는 불교 사원 음식 완전 채식 식사에 대한 이후에해야합니다! ! 캐주얼 유모차 나 나쁜 무릎을 가진 사람들을위한 것이 아닙니다! 위로 올라가면 끊임없이 많은 관찰 지점에서 멋진 경치를 볼 수 있습니다. 산 기슭에서의 쇼핑. 사원은 아슬 아슬합니다!"
광주,무등산국립공원,50,"우리는 버스로 산의 위로 올랐고, 아래로 눌렀다, 아주 간단했고 매우 멋졌다. 산에 난이도 수준 옵션이 많이있었습니다."
광주,무등산국립공원,40,"오르기를 위해 선택할 수있는 다양한 경로가 있으며, 모든 단계에서 아름다움이 있기 때문에 꼭대기에 오르지 않아도됩니다. 특히 가을에, 그것은 전설적입니다. 확실히 거기에서 하루를 보낼만한 가치가있는."
광주,무등산국립공원,50,"무등산 국립 공원을 뛰어 내려 아침 일찍 하이킹을 즐기세요. 점진적인 경사면 덕분에 모든 사람들이 쉽게 올라갈 수 있습니다. 산기슭에는 광주 버스 터미널 (U- 스퀘어 터미널)에서 9 번 버스로 운행되는 공원 인 증심사 (Jeungsimsa Temple)가있다. 레인저 스테이션에서지도 (영어 및 중국어 가능)와 산책로 추천을 확인하십시오. 좀 더 인기있는 내장산만큼이나 혼잡하지는 않지만, 여유로운 속도로 가을 단풍을 즐기기에는 아주 좋습니다. 단풍 나무 터널은 나무가 붉은 색, 깊은 노란색과 오렌지색으로 변해 화려한 색의 아름다움을 지닌 숨 막힐듯한 캐노피를 자랑합니다. 낙엽의 융단은 또한 보는 마법과 낭만적 인 광경입니다. 매우 상쾌하고 선명한 공기, 좋은 산책로 및 친절한 지역 등산객. 10 월 말과 11 월 초 최고."
광주,무등산국립공원,50,"나는 G 1 이후이 국립 공원 옆에 살았으며 몇 가지 다른 코스를 즐기고 싶어하는 하이커들에게이 장소를 강력히 추천합니다. 산 꼭대기까지 올라가는 방법에는 여러 가지가 있습니다. 매주마다 가족과 함께 모든 유형의 것을 시도했습니다. 이 곳은 가족과 함께하는 최고의 장소입니다. 여름철에는 덥고 습하기는하지만 나무가 좋은 꽃과 꽃이 가득한 곳입니다. 겨울철에는 차갑고 하이킹하기가 어렵지만, 산 꼭대기에서 광주의 경관을 볼 수 있습니다. 십대 자녀를 둔 가정 및 가족을 위해이 장소를 강력히 추천합니다."
광주,무등산국립공원,50,"울창한 숲을 가로 지르는 굉장한 인상. 조금만 붐비는 일부 지역 사람들에게는 가능한 한 주말을 피하는 것이 좋습니다. 하이킹 폴은 자신이 소유하고 있으면 편리 할 것입니다. 위부터 광주의 절경과 다양한 트랙과 난이도 중에서 선택할 수 있습니다. 우리는 그럭저럭 공원 정보 센터 중의 1 개시에 영어의지도를 발견 할 수 있었다, 그렇지 않으면 입구 중의 1 개에 큰 선잠의 사진을 가져 간다. 노동 조합 지부는 항상 너무나 안녕하세요를 말하고 있으면서도 친했다. 강력 추천."
